name,novel,publishing year,gender,description,description_words,numpy_array,similarity_scores
Lewin von Vitzewitz,Before the Storm,1878,m,"Lewin von Vitzewitz is a prominent character in Theodor Fontane's novel ""Before the Storm."" He is depicted as a complex and multi-dimensional individual, possessing various characteristics and exhibiting significant actions throughout the story.

Physical Description:
Lewin von Vitzewitz is described as an attractive and well-built young man. He has a tall and sturdy frame, with a noble bearing that reflects his aristocratic background. His deep-set eyes, fair complexion, and neatly groomed brown hair add to his overall charm and attractiveness.

Mental Attributes:
Lewin is portrayed as a highly intelligent and introspective individual. He possesses a sharp intellect and a keen analytical mind. He often engages in deep philosophical and intellectual conversations, displaying a profound understanding of human nature and societal complexities.

Behavioral Traits:
Lewin exhibits a reserved and contemplative demeanor. He is known for his calm and composed nature, rarely showing overt emotional expressions. He tends to observe and analyze situations carefully before formulating his opinions or taking action. Lewin's behavior is often marked by a sense of dignity and integrity, and he is known for his principled approach to life.

Social Interactions:
Lewin occupies a respected position within his social circle. He is seen as a gentleman of high standing and is admired for his intellect and honorable character. While he enjoys the company of others, he also values solitude and introspection. Lewin is selective about his friendships, choosing individuals who share his intellectual and philosophical interests.

Key Actions:

Lewin's most significant action in the novel is his decision to abandon his promising career in the military, rejecting the societal expectations placed upon him as a nobleman. This action reflects his desire for personal freedom and his search for individual fulfillment.

Throughout the story, Lewin engages in intellectual debates and discussions with various characters, demonstrating his intellectual prowess and critical thinking abilities. He provides insightful commentary on political and social issues of the time, often challenging prevailing norms and ideologies.

Lewin forms a deep emotional connection with Effi Briest, the novel's protagonist, and their relationship plays a pivotal role in the narrative. Despite their differences in social status, Lewin's genuine affection for Effi leads him to confront societal conventions and question the established order.

Overall, Lewin von Vitzewitz is portrayed as a multifaceted character in ""Before the Storm."" His physical attributes, mental acuity, dignified behavior, and social standing contribute to his allure. His key actions of rejecting societal expectations, engaging in intellectual discourse, and pursuing an unconventional love interest showcase his individuality and complexity as a character.",lewin von vitzewitz prominent character theodor fontanes novel before storm depicted complex multidimensional individual possessing various characteristic exhibiting significant action throughout story physical description lewin von vitzewitz described attractive wellbuilt young man tall sturdy frame noble bearing reflects aristocratic background deepset eye fair complexion neatly groomed brown hair add overall charm attractiveness mental attribute lewin portrayed highly intelligent introspective individual posse sharp intellect keen analytical mind often engages deep philosophical intellectual conversation displaying profound understanding human nature societal complexity behavioral trait lewin exhibit reserved contemplative demeanor known calm composed nature rarely showing overt emotional expression tends observe analyze situation carefully formulating opinion taking action lewins behavior often marked sense dignity integrity known principled approach life social interaction lewin occupies respected position within social circle seen gentleman high standing admired intellect honorable character enjoys company others also value solitude introspection lewin selective friendship choosing individual share intellectual philosophical interest key action lewins significant action novel decision abandon promising career military rejecting societal expectation placed upon nobleman action reflects desire personal freedom search individual fulfillment throughout story lewin engages intellectual debate discussion various character demonstrating intellectual prowess critical thinking ability provides insightful commentary political social issue time often challenging prevailing norm ideology lewin form deep emotional connection effi briest novel protagonist relationship play pivotal role narrative despite difference social status lewins genuine affection effi lead confront societal convention question established order overall lewin von vitzewitz portrayed multifaceted character before storm physical attribute mental acuity dignified behavior social standing contribute allure key action rejecting societal expectation engaging intellectual discourse pursuing unconventional love interest showcase individuality complexity character,"[ 0.54945898 -0.19549321  1.71623826 ...  0.42532343  0.48135832
 -0.3371253 ]","[('Developmental learning disorder', 0.45981525532926737), ('Obsessive-compulsive disorder', 0.41414153284354505), ('Adjustment disorder', 0.4121711273597825), ('Generalised anxiety disorder', 0.4095877622421805), ('Delusional disorder', 0.40777358821151094)]"
Berndt von Vitzewitz,Before the Storm,1878,m,"Bernd von Vitzewitz, known as Herr auf Hohen-Vietz, is a character in Theodor Fontane's novel ""Before the Storm."" Here is a description of him based on the provided information:

Physical Description:
Bernd von Vitzewitz is described as a man in his late fifties with a ""sturdy figure,"" a dark complexion, and black hair. His physical appearance reflects his mature age and the years of service he spent in the Dragonerregiment Knobelsdorff.

Mental Attributes:
Bernd von Vitzewitz is portrayed as a contemplative and introspective individual. He carries the ""family character"" of the Vitzewitz, which tends to be thoughtful and brooding. Bernd's mental state has been deeply affected by the defeat of Prussia and the death of his beloved wife, Madeleine, after the Battle of Jena-Auerstedt in 1806. His grief and resentment fuel his strong hatred for Napoleon and his desire to restore Prussia's honor.

Behavioral Traits:
Bernd von Vitzewitz exhibits a determined and resolute nature. Fueled by his hatred for Napoleon and the ""Parisian terror men,"" he plans and leads attacks on French soldiers as a form of resistance. He is willing to take matters into his own hands, disregarding the caution of others, and forms volunteer militias, including Volkssturm-Kompanien, to combat the French occupation.

Social Interactions:
Bernd von Vitzewitz's social interactions revolve primarily around his family, including his children Lewin and Renate, and his sister, the Countess Amelie. He seeks solace and finds love and support in his children, hoping that they will bring about a positive change in the ""family character"" inherited from the days of Matthias von Vitzewitz.

Key Actions:

Bernd von Vitzewitz leads a search for thieves who have been committing burglaries in Hohen-Vietz and the surrounding villages. He believes these thieves are French marauders, although they turn out to be local troublemakers Muschwitz and Rosentreter.

Bernd von Vitzewitz plans and organizes attacks on Napoleon's soldiers, aiming to restore Prussia's honor and resist the French occupation. He forms volunteer militias and encourages others to join the cause.

Bernd's plan to ambush the French forces near the Oder River fails due to a lack of Russian support. Lewin is captured, and Bernd harshly blames himself for the unsuccessful operation.

Bernd participates in the rescue of Lewin from prison, alongside Hirschfeldt, Tubal, and Kniehase.

Additionally, Bernd von Vitzewitz expresses joy and approval upon learning of Lewin's engagement to Marie, emphasizing the importance of character and values over social status in their union.

Bernd von Vitzewitz's character embodies a mix of grief, determination, and patriotism as he strives to restore Prussia's honor and protect his family's legacy during a time of turmoil and occupation.",bernd von vitzewitz known herr auf hohenvietz character theodor fontanes novel before storm description based provided information physical description bernd von vitzewitz described man late fifty sturdy figure dark complexion black hair physical appearance reflects mature age year service spent dragonerregiment knobelsdorff mental attribute bernd von vitzewitz portrayed contemplative introspective individual carry family character vitzewitz tends thoughtful brooding bernds mental state deeply affected defeat prussia death beloved wife madeleine battle jenaauerstedt 1806 grief resentment fuel strong hatred napoleon desire restore prussia honor behavioral trait bernd von vitzewitz exhibit determined resolute nature fueled hatred napoleon parisian terror men plan lead attack french soldier form resistance willing take matter hand disregarding caution others form volunteer militia including volkssturmkompanien combat french occupation social interaction bernd von vitzewitzs social interaction revolve primarily around family including child lewin renate sister countess amelie seek solace find love support child hoping bring positive change family character inherited day matthias von vitzewitz key action bernd von vitzewitz lead search thief committing burglary hohenvietz surrounding village belief thief french marauder although turn local troublemaker muschwitz rosentreter bernd von vitzewitz plan organizes attack napoleon soldier aiming restore prussia honor resist french occupation form volunteer militia encourages others join cause bernds plan ambush french force near oder river fails due lack russian support lewin captured bernd harshly blame unsuccessful operation bernd participates rescue lewin prison alongside hirschfeldt tubal kniehase additionally bernd von vitzewitz express joy approval upon learning lewins engagement marie emphasizing importance character value social status union bernd von vitzewitzs character embodies mix grief determination patriotism strives restore prussia honor protect family legacy time turmoil occupation,"[-0.00170706 -0.24559176  1.67389381 ...  0.35168958  0.44959366
 -0.48567459]","[('Prolonged grief disorder', 0.4850778769535467), ('Adjustment disorder', 0.4277340823949308), ('Separation anxiety disorder', 0.41494302519099047), ('Personality disorder', 0.4140706955932012), ('Obsessive-compulsive disorder', 0.4122509317106473)]"
Renate von Vitzewitz,Before the Storm,1878,f,"Renate von Vitzewitz is a character in Theodor Fontane's novel ""Before the Storm."" Based on the additional information provided, here is a description of Renate, including different aspects of her physical, mental, behavioral, and social attributes, as well as key actions:

Physical Description:
There is no specific physical description of Renate von Vitzewitz provided in the available information. As a secondary character, her physical appearance is not given significant attention in the novel.

Mental Attributes:
Renate is depicted as having eyes that express imagination, intelligence, and loyalty. While her intellectual abilities and thought processes are not explicitly described, she is shown to possess a depth of emotion and sensitivity.

Behavioral Traits:
Renate's behavioral traits include a strong bond with her childhood friend, Marie Kniehase, whom she loves like a sister. Renate is known for her loyalty and caring nature, as seen when she tends to her brother Lewin after his breakdown at the Bohlsdorfer Krug inn.

Social Interactions:
Renate's social interactions primarily revolve around her family and close friends, including her brother Lewin and her friend Marie Kniehase. She is familiar with the modest social life at Hohen-Vietz and Schloss Guse, and she envies her cousin Kathinka for the glamorous Berlin society life.

Key Actions:

Renate informs her brother Lewin about the fire that destroys the Saalanbau (hall annex) at Hohen-Vietz, and she expresses an unexplained sense of joy upon seeing it in flames.

After the death of her aunt Amelie in late January 1813, Renate learns from her father that she will inherit Schloss Guse once she marries, as part of Aunt Amelie's ""family plan"" that involves matching Renate with Tubal von Ladalinski.

Renate's relationship with Tubal is complicated by doubts and uncertainties. Marie conveys Renate's concerns about Tubal's lack of self-assurance in his own love for her. Despite this, Renate remains committed to Tubal and asks him to wait before making any commitments.

Renate speaks the ninth verse of the Passion hymn ""O Haupt voll Blut und Wunden"" at Tubal's request on his deathbed. His death deeply affects Renate.

Towards the end of the novel, it is revealed through Renate's diary that she continues to live at Hohen-Vietz until her father's death. Afterward, Lewin and Marie take over the estate, while Renate moves to the noble ladies' foundation Kloster Lindow, avoiding becoming the ""Aunt Schorlemmer of her house."" Renate eventually dies and is buried at Kloster Lindow.

Renate von Vitzewitz's character embodies loyalty, emotional depth, and the challenges of love and uncertainty. While her actions may not drive the central plot, she contributes to the emotional landscape and dynamics of the Vitzewitz family, particularly in her relationship with Tubal.",renate von vitzewitz character theodor fontanes novel before storm based additional information provided description renate including different aspect physical mental behavioral social attribute well key action physical description specific physical description renate von vitzewitz provided available information secondary character physical appearance given significant attention novel mental attribute renate depicted eye express imagination intelligence loyalty intellectual ability thought process explicitly described shown posse depth emotion sensitivity behavioral trait renates behavioral trait include strong bond childhood friend marie kniehase love like sister renate known loyalty caring nature seen tends brother lewin breakdown bohlsdorfer krug inn social interaction renates social interaction primarily revolve around family close friend including brother lewin friend marie kniehase familiar modest social life hohenvietz schloss guse envy cousin kathinka glamorous berlin society life key action renate informs brother lewin fire destroys saalanbau hall annex hohenvietz express unexplained sense joy upon seeing flame death aunt amelie late january 1813 renate learns father inherit schloss guse marries part aunt amelies family plan involves matching renate tubal von ladalinski renates relationship tubal complicated doubt uncertainty marie conveys renates concern tubals lack selfassurance love her despite this renate remains committed tubal asks wait making commitment renate speaks ninth verse passion hymn o haupt voll blut und wunden tubals request deathbed death deeply affect renate towards end novel revealed renates diary continues live hohenvietz father death afterward lewin marie take estate renate move noble lady foundation kloster lindow avoiding becoming aunt schorlemmer house renate eventually dy buried kloster lindow renate von vitzewitzs character embodies loyalty emotional depth challenge love uncertainty action may drive central plot contributes emotional landscape dynamic vitzewitz family particularly relationship tubal,"[-0.2345947  -0.31701267  1.15124321 ...  0.10084076  0.80707371
 -0.42192233]","[('Personality disorder', 0.4963348429420443), ('Separation anxiety disorder', 0.464957667150371), ('Complex post traumatic stress disorder', 0.4486722506876969), ('Obsessive-compulsive disorder', 0.4198343227092586), ('Schizotypal disorder', 0.40134767442980024)]"
Tante Brigitte Schorlemmer,Before the Storm,1878,f,"
Brigitte Schorlemmer is a character in Theodor Fontane's novel ""Before the Storm."" Here is a description of Brigitte, including different aspects of her physical, mental, behavioral, and social attributes, as well as key actions:

Physical Description:
Brigitte Schorlemmer is described as being in her fifties, often dressed in gray with a small tulle bonnet and white cloth. She is typically seen engaged in knitting scarves for ""her Greenlanders"" during her free time.

Mental Attributes:
Brigitte is depicted as a calm and serene individual. She exudes an aura of tranquility and peace, and while she may not possess the ability to spread joy or make a dull day less dreary, she is accompanied by an air of serenity.

Behavioral Traits:
Brigitte is known for her role as the housekeeper at Hohen-Vietz, entrusted with the care of young Renate after the death of Bernd von Vitzewitz's wife in 1806. She has become a beloved member of the family and is not considered a peripheral character in the story.

Social Interactions:
Brigitte's social interactions primarily revolve around her relationship with the Vitzewitz family. She is highly respected and valued by all family members. However, there are differing opinions regarding her Christianity. While Berndt holds deep respect for her Moravian beliefs and appreciates her lack of passion as a blessing, Lewin and Renate find her passionlessness disconcerting, as she tends to offer Christian proverbs instead of words of empathy and sympathy.

Key Actions:

Brigitte provides comfort and solace to Renate by sharing the story of Kajarnak, the first baptized Greenlander, when Renate is feverish.

When Lewin falls ill at the Bohlsdorfer Krug inn, Brigitte stays there with Renate and takes care of him.

Brigitte sympathizes with the conventicler Uhlenhorst and his followers, indicating her alignment with their religious beliefs.

Generalmajor von Bamme despises Brigitte, and when he stays at Hohen-Vietz, she strictly instructs all female servants not to enter his room, even when he rings the bell persistently.

Brigitte advises Marie to reject Bamme's inheritance.

Brigitte Schorlemmer's character embodies a sense of calmness and tranquility in the midst of turbulent times. While her actions may not be central to the main plot, she serves as a source of stability and support within the Vitzewitz household. Her Moravian beliefs and stoic demeanor elicit various reactions from different family members, reflecting the complexity of her character and the differing perspectives on faith and compassion.",brigitte schorlemmer character theodor fontanes novel before storm description brigitte including different aspect physical mental behavioral social attribute well key action physical description brigitte schorlemmer described fifty often dressed gray small tulle bonnet white cloth typically seen engaged knitting scarf her greenlanders free time mental attribute brigitte depicted calm serene individual exudes aura tranquility peace may posse ability spread joy make dull day le dreary accompanied air serenity behavioral trait brigitte known role housekeeper hohenvietz entrusted care young renate death bernd von vitzewitzs wife 1806 become beloved member family considered peripheral character story social interaction brigittes social interaction primarily revolve around relationship vitzewitz family highly respected valued family member however differing opinion regarding christianity berndt hold deep respect moravian belief appreciates lack passion blessing lewin renate find passionlessness disconcerting tends offer christian proverb instead word empathy sympathy key action brigitte provides comfort solace renate sharing story kajarnak first baptized greenlander renate feverish lewin fall ill bohlsdorfer krug inn brigitte stay renate take care him brigitte sympathizes conventicler uhlenhorst follower indicating alignment religious belief generalmajor von bamme despises brigitte stay hohenvietz strictly instructs female servant enter room even ring bell persistently brigitte advises marie reject bammes inheritance brigitte schorlemmers character embodies sense calmness tranquility midst turbulent time action may central main plot serf source stability support within vitzewitz household moravian belief stoic demeanor elicit various reaction different family member reflecting complexity character differing perspective faith compassion,"[-0.27644169 -0.21589708  0.77539676 ...  0.22982912  0.59182918
 -0.80260503]","[('Generalised anxiety disorder', 0.4168955782497582), ('Prolonged grief disorder', 0.40649209731391694), ('Adjustment disorder', 0.39878289446638726), ('Obsessive-compulsive disorder', 0.365719768141902), ('Agoraphobia', 0.3624499762241904)]"
