name,novel,publishing year,gender,description,description_words,numpy_array,similarity_scores
Professor Wilibald Schmidt,Frau Jenny Treibel,1892,m,"Professor Wilibald Schmidt is a significant character in Theodor Fontane's novel ""Frau Jenny Treibel."" Here is a description of Professor Schmidt based on the available information:

Physical Description:
The novel does not provide specific physical details about Professor Wilibald Schmidt.

Mental Attributes:
Professor Wilibald Schmidt is described as a Gymnasial professor who possesses characteristics such as self-irony, humor, and free-thinking without prejudices or class snobbery. He has a keen sense of wit and exhibits a level of wisdom and insight that allows him to question established conventions and traditions within the academic sphere. He demonstrates a preference for self-reflection and self-awareness, valuing the highest standpoint of self-irony (6/65; 7/86). He maintains an open mind towards societal changes and welcomes the shift from authority based on rank to one based on genuine knowledge and skills (6/72).

Behavioral Traits:
Professor Wilibald Schmidt leads a rather withdrawn life, residing in an old-fashioned but respectable house on Berlin's Adlerstraße with his daughter, Corinna, and their housekeeper, Schmolke. He moves between his work at school and his study, interrupted only occasionally by social events (1/5).

Social Interactions:
Professor Wilibald Schmidt is part of a circle of colleagues who gather for regular evenings of intellectual and social interaction. He playfully names their group ""The Seven Orphans of Greece,"" challenging the wisdom of the scholarly profession while embracing self-irony (6/65; 7/86). He opposes attempts by colleagues to exclude the art teacher, Friedeberg, from the group due to his lack of scholarly qualifications (6/64). He also rejects his friend Distelkamp's reservations about Heinrich Schliemann's lack of formal education and enthusiastically studies Schliemann's excavation reports (6/73).

Key Actions:
Professor Wilibald Schmidt remains relatively passive and non-interfering in his daughter Corinna's escapades, believing that interference would disrupt the natural course of events (7/93). He places great trust in his daughter and even more so in his ""friend Jenny"" (Jenny Treibel), believing that Jenny's practical mindset will prevent any connection between Corinna and Jenny's son, Leopold, at all costs. He navigates household tensions with little concern, displaying the characteristics of a lovable egoist (15/203).

While Professor Schmidt maintains an unyielding gaze towards Jenny Treibel's character, he manages to find reconciliatory words for her and even for her manipulative use of his past love song at Corinna and Marcell's wedding celebration (16/222 f.). The ""classical"" element that he attributes to his nephew Marcell also resonates within himself, representing a perspective that frees the soul, transcends pettiness, and embraces forgiveness and forgetting due to the shared human lack of glory (16/212).

Overall, Professor Wilibald Schmidt embodies intellectual curiosity, a witty disposition, and a flexible mindset that enables him to question and challenge societal norms. He serves as a voice of reason and moderation amidst the complexities of the characters and events in the novel.",professor wilibald schmidt significant character theodor fontanes novel frau jenny treibel description professor schmidt based available information physical description novel provide specific physical detail professor wilibald schmidt mental attribute professor wilibald schmidt described gymnasial professor posse characteristic selfirony humor freethinking without prejudice class snobbery keen sense wit exhibit level wisdom insight allows question established convention tradition within academic sphere demonstrates preference selfreflection selfawareness valuing highest standpoint selfirony 665 786 maintains open mind towards societal change welcome shift authority based rank one based genuine knowledge skill 672 behavioral trait professor wilibald schmidt lead rather withdrawn life residing oldfashioned respectable house berlin adlerstraße daughter corinna housekeeper schmolke move work school study interrupted occasionally social event 15 social interaction professor wilibald schmidt part circle colleague gather regular evening intellectual social interaction playfully name group the seven orphan greece challenging wisdom scholarly profession embracing selfirony 665 786 opposes attempt colleague exclude art teacher friedeberg group due lack scholarly qualification 664 also reject friend distelkamps reservation heinrich schliemann lack formal education enthusiastically study schliemann excavation report 673 key action professor wilibald schmidt remains relatively passive noninterfering daughter corinnas escapade believing interference would disrupt natural course event 793 place great trust daughter even friend jenny jenny treibel believing jenny practical mindset prevent connection corinna jenny son leopold cost navigates household tension little concern displaying characteristic lovable egoist 15203 professor schmidt maintains unyielding gaze towards jenny treibels character manages find reconciliatory word even manipulative use past love song corinna marcells wedding celebration 16222 f classical element attribute nephew marcell also resonates within himself representing perspective free soul transcends pettiness embrace forgiveness forgetting due shared human lack glory 16212 overall professor wilibald schmidt embodies intellectual curiosity witty disposition flexible mindset enables question challenge societal norm serf voice reason moderation amidst complexity character event novel,"[-0.18497346 -0.72045666  0.97482598 ...  0.26764575  0.79690504
  0.12044331]","[('Personality disorder', 0.4407320250181074), ('Secondary neurodevelopmental syndrome', 0.4107406511684437), ('Body dysmorphic disorder', 0.40922071272639415), ('Secondary personality change', 0.40902091738978863), ('Delusional disorder', 0.4072122813953928)]"
Corinna Schmidt,Frau Jenny Treibel,1892,f,"Corinna Schmidt is a significant character in Theodor Fontane's novel ""Frau Jenny Treibel."" Here is a description of Corinna Schmidt based on the available information:

Physical Description:
The novel does not provide specific physical details about Corinna Schmidt.

Mental Attributes:
Corinna Schmidt is portrayed as a clever and capable young woman. She is described as highly intelligent and spirited (7/87 f.). Having grown up with her father, Professor Wilibald Schmidt, and experiencing a significant amount of freedom, she is deemed to have been raised somewhat wild (11/160). Although her mother died at an early age, Corinna had the guidance of the housekeeper, Schmolke, who played a partial motherly role in her life (11/160).

Behavioral Traits:
Corinna Schmidt exhibits a certain inclination towards modernity, which her cousin Marcell Wedderkopp laments, considering it a flaw (7/88). However, her father, Wilibald Schmidt, views this trait as relatively insignificant (7/86-90). The modern aspect that Marcell and Wilibald refer to relates to Corinna's focus on external appearances (15/208), her openly admitted penchant for luxury and comfort (5/62), and her desire to escape the modest circumstances of the scholarly and teaching milieu in which she grew up. She believes that marrying into wealth is the solution and, thus, becomes determined to marry Leopold, the younger son of Jenny Treibel, despite not loving him and the prospect of being bored in his company, as predicted by Marcell (5/61).

Key Actions:
Corinna skillfully captivates Leopold's attention, leading to a secret engagement that she persists with, despite knowing it is against her better judgment. Encountering Jenny Treibel's forceful and hurtful resistance only strengthens her resolve for a few weeks. However, Corinna is fully aware of her ""guilt"" and acknowledges that everything is mere calculation, acknowledging that she is toying with Leopold's feelings (14/195).

During this period, Corinna visits the wives of professors, indicating her attempt to reconcile with the ""lifestyle she had mocked"" (15/208 f.). The final catalyst for her introspection is Schmolke (14/200-203), prompting Corinna to break off the engagement. Marcell, who has just secured a position as a Gymnasial Oberlehrer (15/205), forgives her and makes the reconciliation easy, earning her the double apostrophe of being a ""fortunate child"" first from her father (16/212) and then from Schmolke, who succinctly states, ""You acted irresponsibly and almost horribly but still managed to get him. You are a fortunate child"" (16/213). Two days later, the engagement announcement appears, and the novel concludes with their wedding celebration.",corinna schmidt significant character theodor fontanes novel frau jenny treibel description corinna schmidt based available information physical description novel provide specific physical detail corinna schmidt mental attribute corinna schmidt portrayed clever capable young woman described highly intelligent spirited 787 f grown father professor wilibald schmidt experiencing significant amount freedom deemed raised somewhat wild 11160 although mother died early age corinna guidance housekeeper schmolke played partial motherly role life 11160 behavioral trait corinna schmidt exhibit certain inclination towards modernity cousin marcell wedderkopp lament considering flaw 788 however father wilibald schmidt view trait relatively insignificant 78690 modern aspect marcell wilibald refer relates corinnas focus external appearance 15208 openly admitted penchant luxury comfort 562 desire escape modest circumstance scholarly teaching milieu grew up belief marrying wealth solution and thus becomes determined marry leopold younger son jenny treibel despite loving prospect bored company predicted marcell 561 key action corinna skillfully captivates leopolds attention leading secret engagement persists with despite knowing better judgment encountering jenny treibels forceful hurtful resistance strengthens resolve week however corinna fully aware guilt acknowledges everything mere calculation acknowledging toying leopolds feeling 14195 period corinna visit wife professor indicating attempt reconcile lifestyle mocked 15208 f final catalyst introspection schmolke 14200203 prompting corinna break engagement marcell secured position gymnasial oberlehrer 15205 forgives make reconciliation easy earning double apostrophe fortunate child first father 16212 schmolke succinctly state you acted irresponsibly almost horribly still managed get him fortunate child 16213 two day later engagement announcement appears novel concludes wedding celebration,"[-0.31411043 -0.09091982  0.95264041 ...  0.35395733  0.67200089
 -0.09068966]","[('Separation anxiety disorder', 0.37943282596871053), ('Personality disorder', 0.36023546716004307), ('Prolonged grief disorder', 0.35708323776123924), ('Selective mutism', 0.35206122621234837), ('Developmental learning disorder', 0.3451100461605112)]"
Count Helmut Holk,Irretrievable,1892,m,"Count Helmut Holk is a significant character in Theodor Fontane's novel ""Irretrievable."" Here is a description of Count Helmut Holk based on the available information:

Physical Description:
The novel does not provide specific physical details about Count Helmut Holk.

Mental Attributes:
Count Helmut Holk is described as a good and excellent man, although he acknowledges that his wife, Christine Holk, possesses higher qualities than he does (II/11). He is aware of his own average capabilities and often exhibits excessive adoration and chivalry towards his wife, showing great flexibility and humility (V/38). However, in recent times, he occasionally desires a less exceptional wife (II/11). He is prone to being irritated by his wife's self-righteousness and moral absolutism (V/40, XVIII/160). Holk is characterized as a person who lives in the moment and subscribes to the saying, ""after us, the deluge"" (V/38). His need for variety and change is fulfilled during his stay in Copenhagen, and the ongoing discord in his correspondence with his wife opens him up to the allure of the beautiful captain's wife, Brigitte Hansen, and the court lady, Ebba von Rosenberg. Their libertine lifestyles, which contrast with his wife's strict moral code, both intrigue and unsettle him. Ebba von Rosenberg describes Holk as someone who oscillates between opposites, seeking to reconcile incompatible elements within himself, such as Schleswig-Holstein patriotism and Danish court service, aristocracy and liberalism, morality and libertinism (XVIII/154). Holk is unaware of her critical perception of him. He falls in love with her, misinterpreting her flirtations as encouragement and a nighttime tête-à-tête in Frederiksborg as a sign of reciprocation. He travels to Holkenäs to convey his desire for divorce to his wife and then, upon returning to Copenhagen, realizes that he has taken appearances and games for reality. Ebba rejects his proposal and bluntly reveals her low opinion of him, calling him not a hero of love but merely her Don Quixote (XXX/266).

Behavioral Traits:
Count Helmut Holk's behavior demonstrates a conflict between his desire for stability and his attraction to the libertine lifestyles of Brigitte Hansen and Ebba von Rosenberg. He falls into a state of infatuation with Ebba, leading him to seek a divorce from his wife. After the divorce, he embarks on a two-year journey through Europe while his brother-in-law and Pastor Petersen attempt to persuade Christine to remarry. Although their efforts are successful, the anticipated happiness eludes them. Christine, unable to forget, takes her own life (XXXIII/286).

Social Context:
As the Gutsherr (estate owner) of Holkenäs and the chamberlain of Danish Princess Maria Eleonore, Count Helmut Holk occupies a privileged social position. His association with the Danish court and his status as a nobleman grant him access to higher social circles.

Key Actions:

Exhibits excessive adoration and chivalry towards his wife, Christine, and readily acknowledges her superior qualities.
Develops discontentment with his wife's self-righteousness and moral absolutism.
Becomes attracted to the libertine lifestyles of Brigitte Hansen and Ebba von Rosenberg during his stay in Copenhagen.
Falls in love with Ebba and misinterprets her actions as reciprocal affection.
Seeks a divorce from Christine and realizes his misjudgment upon Ebba's rejection.
Embarks on a two-year journey through Europe while efforts are made to persuade Christine to remarry.
Experiences a failed attempt at finding new happiness as Christine takes her own life.
Count Helmut Holk's character is marked by his internal conflicts, wavering between stability and attraction to forbidden lifestyles. His pursuit of his own desires ultimately leads to tragedy for both himself and his wife.",count helmut holk significant character theodor fontanes novel irretrievable description count helmut holk based available information physical description novel provide specific physical detail count helmut holk mental attribute count helmut holk described good excellent man although acknowledges wife christine holk posse higher quality ii11 aware average capability often exhibit excessive adoration chivalry towards wife showing great flexibility humility v38 however recent time occasionally desire le exceptional wife ii11 prone irritated wife selfrighteousness moral absolutism v40 xviii160 holk characterized person life moment subscribes saying after u deluge v38 need variety change fulfilled stay copenhagen ongoing discord correspondence wife open allure beautiful captain wife brigitte hansen court lady ebba von rosenberg libertine lifestyle contrast wife strict moral code intrigue unsettle him ebba von rosenberg describes holk someone oscillates opposite seeking reconcile incompatible element within himself schleswigholstein patriotism danish court service aristocracy liberalism morality libertinism xviii154 holk unaware critical perception him fall love her misinterpreting flirtation encouragement nighttime têteàtête frederiksborg sign reciprocation travel holkenäs convey desire divorce wife then upon returning copenhagen realizes taken appearance game reality ebba reject proposal bluntly reveals low opinion him calling hero love merely quixote xxx266 behavioral trait count helmut holks behavior demonstrates conflict desire stability attraction libertine lifestyle brigitte hansen ebba von rosenberg fall state infatuation ebba leading seek divorce wife divorce embarks twoyear journey europe brotherinlaw pastor petersen attempt persuade christine remarry although effort successful anticipated happiness eludes them christine unable forget take life xxxiii286 social context gutsherr estate owner holkenäs chamberlain danish princess maria eleonore count helmut holk occupies privileged social position association danish court status nobleman grant access higher social circle key action exhibit excessive adoration chivalry towards wife christine readily acknowledges superior quality develops discontentment wife selfrighteousness moral absolutism becomes attracted libertine lifestyle brigitte hansen ebba von rosenberg stay copenhagen fall love ebba misinterprets action reciprocal affection seek divorce christine realizes misjudgment upon ebbas rejection embarks twoyear journey europe effort made persuade christine remarry experience failed attempt finding new happiness christine take life count helmut holks character marked internal conflict wavering stability attraction forbidden lifestyle pursuit desire ultimately lead tragedy wife,"[ 0.72030568 -0.28280437  1.15769279 ... -0.15316512  0.70976764
 -0.38391358]","[('Personality disorder', 0.44758027262137), ('Complex post traumatic stress disorder', 0.4212051216947887), ('Oppositional defiant disorder', 0.40179547136006477), ('Body integrity dysphoria', 0.4008395501821672), ('Compulsive sexual behaviour disorder', 0.39724560726288133)]"
Countess Christine Holk,Irretrievable,1892,f,"Countess Christine Holk is a significant character in Theodor Fontane's novel ""Irretrievable."" Here is a description of Christine Holk based on the available information:

Physical Description:
The novel does not provide specific physical details about Countess Christine Holk.

Mental Attributes:
Christine Holk was raised in the Moravian community and spent her formative years at the pietistic boarding school ""Gnadenfrei."" Her upbringing in this religious environment strongly influenced her piety and righteousness. However, her brother, Baron Arne, recognizes a strong sense of self-righteousness and hidden pride in her religious devotion, which Christine herself fails to acknowledge (V/40). She has a serious nature, is never cheerful (IV/27), and tends towards melancholy, in stark contrast to her carefree husband. Despite their differences, they have a happy marriage for many years, largely due to Holk's willingness to wholeheartedly admire his wife's virtuousness and willingly take a secondary role (V/38). However, this dynamic has changed in recent times, with Holk growing increasingly irritable towards Christine's doctrinal tone (XIX/160), and she finds it increasingly difficult to respect his carefree nature (IV/33). The letters exchanged between the couple during Holk's stay in Copenhagen deepen the discord, as they fail to strike the right tone and end up hurting each other with pointed remarks and allusions. Christine becomes jealous of Holk's reports about Brigitte Hansen and Ebba von Rosenberg, and her own growing inclination to give up on their marital happiness before Holk's departure (IV/33). Therefore, when Holk expresses his desire for a divorce, she not only fails to oppose it but even takes the words out of his mouth, missing the opportunity to lead him to the realization of his mistake (XXIX/253).

Behavioral Traits:
Following the divorce, Christine lives in Gnadenfrei with her friend Julie von Dobschütz. The reconciliation efforts made by her brother and Pastor Petersen two years later fail to bring back happiness. Christine ""wants to forget, but she cannot"" (XXIII/286). A quarter of a year after her remarriage, she takes her own life in the Baltic Sea.

Social Context:
As a countess and the wife of Graf Holk, Christine occupies a prominent social position. Her religious upbringing and adherence to piety likely shape her social interactions and connections within the Moravian community and other circles.

Key Actions:

Raised in the Moravian community and educated at the pietistic boarding school ""Gnadenfrei.""
Maintains a serious and melancholic nature throughout the novel, in contrast to her carefree husband.
Engages in a happy marriage with Graf Holk for many years, though the relationship deteriorates over time.
Fails to address Holk's desire for a divorce, missing the chance to reconcile their differences and guide him towards recognizing his mistake.
Lives with her friend Julie von Dobschütz in Gnadenfrei following the divorce.
Takes her own life in the Baltic Sea a quarter of a year after her remarriage.
Christine's character is marked by her piety, self-righteousness, and a lack of compatibility with her husband's carefree nature, ultimately leading to a tragic end.",countess christine holk significant character theodor fontanes novel irretrievable description christine holk based available information physical description novel provide specific physical detail countess christine holk mental attribute christine holk raised moravian community spent formative year pietistic boarding school gnadenfrei upbringing religious environment strongly influenced piety righteousness however brother baron arne recognizes strong sense selfrighteousness hidden pride religious devotion christine fails acknowledge v40 serious nature never cheerful iv27 tends towards melancholy stark contrast carefree husband despite difference happy marriage many year largely due holks willingness wholeheartedly admire wife virtuousness willingly take secondary role v38 however dynamic changed recent time holk growing increasingly irritable towards christines doctrinal tone xix160 find increasingly difficult respect carefree nature iv33 letter exchanged couple holks stay copenhagen deepen discord fail strike right tone end hurting pointed remark allusion christine becomes jealous holks report brigitte hansen ebba von rosenberg growing inclination give marital happiness holks departure iv33 therefore holk express desire divorce fails oppose even take word mouth missing opportunity lead realization mistake xxix253 behavioral trait following divorce christine life gnadenfrei friend julie von dobschütz reconciliation effort made brother pastor petersen two year later fail bring back happiness christine want forget cannot xxiii286 quarter year remarriage take life baltic sea social context countess wife graf holk christine occupies prominent social position religious upbringing adherence piety likely shape social interaction connection within moravian community circle key action raised moravian community educated pietistic boarding school gnadenfrei maintains serious melancholic nature throughout novel contrast carefree husband engages happy marriage graf holk many year though relationship deteriorates time fails address holks desire divorce missing chance reconcile difference guide towards recognizing mistake life friend julie von dobschütz gnadenfrei following divorce take life baltic sea quarter year remarriage christines character marked piety selfrighteousness lack compatibility husband carefree nature ultimately leading tragic end,"[ 0.61739266 -0.64448959  0.70022559 ... -0.02301258  1.22474706
 -0.04288163]","[('Prolonged grief disorder', 0.46889839608364803), ('Personality disorder', 0.44924340899714227), ('Separation anxiety disorder', 0.4433186284541252), ('Complex post traumatic stress disorder', 0.4430626064091817), ('Oppositional defiant disorder', 0.432708162754853)]"
