name,novel,publishing year,gender,description,description_words,numpy_array,similarity_scores
Woldemar von Stechlin,The Stechlin,1898,m,"Woldemar von Stechlin, a character in Theodor Fontane's novel ""The Stechlin,"" can be described in different aspects including physical, mental, behavioral, social, and others. Here is a description of Woldemar von Stechlin based on the available information:

Physical Description:
No specific physical details are provided in the available information regarding Woldemar von Stechlin's appearance.

Mental Attributes:
Woldemar von Stechlin is depicted as an all-around popular character who is well-liked by those around him. He is described by his friend Czako as ""the best guy in the world"" and is valued for his moral nature by Rex. Woldemar is known for his diplomatic skills and the ability to handle various social situations and conversations.

Behavioral Traits:
Woldemar von Stechlin demonstrates polite and respectful behavior. He shows his diplomatic abilities by mediating conflicts and intervening in various situations involving other characters. He is adaptable and able to interact positively with different people, including reclusive individuals like Triglaff and sensitive artists like Wrschowitz and Cujacius.

Social Interactions:
Woldemar von Stechlin is well-regarded by his peers, superiors, and acquaintances. He is highly valued in his regiment, where he is considered a favorite among both his comrades and superiors. The Barbys, including Graf Barby and his daughters, develop friendly feelings toward Woldemar and appreciate his calm and natural demeanor.

Woldemar's Character Strength:
Woldemar is seen as a person of good character, but some characters express doubts about his strength of character. Czako mentions that Woldemar may not be able to match the Princes in his regiment and suggests that he may succumb to certain indulgences. Dubslav is uncertain about Woldemar's political views, although he acknowledges his strong liberal leanings.

Relationship with Melusine:
Melusine, Dubslav's sister, believes that Woldemar needs support due to his refined nature and his vulnerability to differing opinions and societal prejudices. Woldemar's comments about his friends Czako and Rex, which display a hint of arrogance, validate Melusine's concerns. Adelheid is surprised by Woldemar's prejudiced and overconfident remarks.

Character Traits:
Woldemar is described as lacking in character strength and exhibiting a certain stiffness. Dubslav criticizes Woldemar's lack of passionate expression regarding his marriage plans, and Melusine finds it inappropriate that he shows excessive excitement about visiting the Sixtine Madonna rather than focusing on his bride during their honeymoon. However, Woldemar's choice of Armgard over Melusine confirms that he has chosen the right sister, even though most other characters find Melusine more interesting.

Understanding of Dubslav:
Woldemar has a deep understanding of his father, Dubslav. He worries that Dubslav's political aspirations could make him a comical figure, even though he loves his father dearly. Woldemar is convinced that a seat in the Reichstag is not suitable for Dubslav, and he is ultimately relieved when Dubslav loses the election. Although Woldemar initially finds Dubslav's response to their engagement letter inappropriate, he quickly overcomes his discomfort and appreciates his father's loving and humorous words.

Transition and Future:
Woldemar is deeply affected by Dubslav's death, especially since he and Armgard are still on their honeymoon when they learn about it. However, just a few months later, Woldemar is delighted when Armgard expresses her desire to move to Stechlin. He has no difficulty leaving the military, as he believes he is not destined to become a high-ranking officer but rather identifies with the old Junker traditions that he once believed he had left behind.",woldemar von stechlin character theodor fontanes novel the stechlin described different aspect including physical mental behavioral social others description woldemar von stechlin based available information physical description specific physical detail provided available information regarding woldemar von stechlins appearance mental attribute woldemar von stechlin depicted allaround popular character wellliked around him described friend czako the best guy world valued moral nature rex woldemar known diplomatic skill ability handle various social situation conversation behavioral trait woldemar von stechlin demonstrates polite respectful behavior show diplomatic ability mediating conflict intervening various situation involving character adaptable able interact positively different people including reclusive individual like triglaff sensitive artist like wrschowitz cujacius social interaction woldemar von stechlin wellregarded peer superior acquaintance highly valued regiment considered favorite among comrade superior barbys including graf barby daughter develop friendly feeling toward woldemar appreciate calm natural demeanor woldemars character strength woldemar seen person good character character express doubt strength character czako mention woldemar may able match prince regiment suggests may succumb certain indulgence dubslav uncertain woldemars political view although acknowledges strong liberal leaning relationship melusine melusine dubslavs sister belief woldemar need support due refined nature vulnerability differing opinion societal prejudice woldemars comment friend czako rex display hint arrogance validate melusines concern adelheid surprised woldemars prejudiced overconfident remark character trait woldemar described lacking character strength exhibiting certain stiffness dubslav criticizes woldemars lack passionate expression regarding marriage plan melusine find inappropriate show excessive excitement visiting sixtine madonna rather focusing bride honeymoon however woldemars choice armgard melusine confirms chosen right sister even though character find melusine interesting understanding dubslav woldemar deep understanding father dubslav worry dubslavs political aspiration could make comical figure even though love father dearly woldemar convinced seat reichstag suitable dubslav ultimately relieved dubslav loses election although woldemar initially find dubslavs response engagement letter inappropriate quickly overcomes discomfort appreciates father loving humorous word transition future woldemar deeply affected dubslavs death especially since armgard still honeymoon learn it however month later woldemar delighted armgard express desire move stechlin difficulty leaving military belief destined become highranking officer rather identifies old junker tradition believed left behind,"[ 0.23519252 -0.36289516  1.70044041 ...  0.12862569  0.42863238
 -0.24065185]","[('Personality disorder', 0.39400368380404655), ('Social anxiety disorder', 0.35870989317285884), ('Schizotypal disorder', 0.3574753598319414), ('Selective mutism', 0.3522567922415841), ('Delusional disorder', 0.33618335979636216)]"
Pastor Lorenzen,The Stechlin,1898,m,"Pastor Lorenzen, a character in Theodor Fontane's novel ""The Stechlin,"" can be described in different aspects including physical, mental, behavioral, social, and others. Here is a description of Pastor Lorenzen based on the available information:

Physical Description:
No specific physical details are provided in the available information regarding Pastor Lorenzen's appearance.

Mental Attributes:
Pastor Lorenzen is depicted as a thoughtful and diplomatic individual. He possesses a calm and composed demeanor and avoids conflict whenever possible. He is a reflective person who carefully considers his words and actions.

Behavioral Traits:
Pastor Lorenzen is known for his quiet and reserved nature. He often remains silent during social gatherings and conversations, giving the impression that he is waiting for the Holy Spirit. Despite being a man of few words, he is highly respected by Dubslav von Stechlin and other characters in the novel.

Social Interactions:
Pastor Lorenzen serves as the pastor in Stechlin and lives in the local parish. He is unmarried and has Frau Kulicke to manage the household for him. He is well-known and respected in the community, often being invited to social events and gatherings. Although he is not particularly talkative or sociable, he is regarded as a trustworthy and reliable person by those who know him well.

Political and Religious Views:
Pastor Lorenzen holds a critical stance towards the church as an institution. He finds it problematic when people blindly defend traditional beliefs and customs without considering their underlying meaning. He believes in the importance of questioning established norms and adapting to the changing times. While he is politically interested and associated with the Christian Social Movement, he is not an aggressive advocate and prefers a more moderate and practical approach to social change.

Key Actions:

Pastor Lorenzen plays a significant role in the education and upbringing of Woldemar, Dubslav von Stechlin's son. He serves as Woldemar's teacher, mentor, and friend, guiding him through life and imparting valuable lessons.
He maintains a close and enduring friendship with Dubslav, who holds him in high regard and considers him a sincere and trustworthy individual.
Pastor Lorenzen engages in discussions with Melusine and others regarding the conflict between the old and the new, expressing his belief in the necessity of adapting to a democratic worldview and embracing change.
Despite his critical stance towards the church, Lorenzen fulfills his pastoral duties and provides spiritual guidance to the community.
He values honesty and integrity and is seen as a person of strong principles, even if his views sometimes differ from those of his acquaintances.
Pastor Lorenzen delivers a eulogy at Dubslav's funeral, expressing his deep affection and admiration for his late friend, highlighting their differences of opinion but also emphasizing Dubslav's genuine character and the impact he had on their lives.
Overall, Pastor Lorenzen is portrayed as a thoughtful and introspective character who values sincerity and strives to make a positive impact on the lives of those around him. His reserved nature and critical thinking contribute to his wisdom and the respect he receives from others.",pastor lorenzen character theodor fontanes novel the stechlin described different aspect including physical mental behavioral social others description pastor lorenzen based available information physical description specific physical detail provided available information regarding pastor lorenzens appearance mental attribute pastor lorenzen depicted thoughtful diplomatic individual posse calm composed demeanor avoids conflict whenever possible reflective person carefully considers word action behavioral trait pastor lorenzen known quiet reserved nature often remains silent social gathering conversation giving impression waiting holy spirit despite man word highly respected dubslav von stechlin character novel social interaction pastor lorenzen serf pastor stechlin life local parish unmarried frau kulicke manage household him wellknown respected community often invited social event gathering although particularly talkative sociable regarded trustworthy reliable person know well political religious view pastor lorenzen hold critical stance towards church institution find problematic people blindly defend traditional belief custom without considering underlying meaning belief importance questioning established norm adapting changing time politically interested associated christian social movement aggressive advocate prefers moderate practical approach social change key action pastor lorenzen play significant role education upbringing woldemar dubslav von stechlins son serf woldemars teacher mentor friend guiding life imparting valuable lesson maintains close enduring friendship dubslav hold high regard considers sincere trustworthy individual pastor lorenzen engages discussion melusine others regarding conflict old new expressing belief necessity adapting democratic worldview embracing change despite critical stance towards church lorenzen fulfills pastoral duty provides spiritual guidance community value honesty integrity seen person strong principle even view sometimes differ acquaintance pastor lorenzen delivers eulogy dubslavs funeral expressing deep affection admiration late friend highlighting difference opinion also emphasizing dubslavs genuine character impact life overall pastor lorenzen portrayed thoughtful introspective character value sincerity strives make positive impact life around him reserved nature critical thinking contribute wisdom respect receives others,"[ 0.14203165 -0.5502373   1.35775054 ...  0.51671946  0.5024035
  0.1080347 ]","[('Personality disorder', 0.38501814897787134), ('Selective mutism', 0.37910448010542386), ('Agoraphobia', 0.37772951599057797), ('Adjustment disorder', 0.3730204263808629), ('Generalised anxiety disorder', 0.3712575747814252)]"
Melusine,The Stechlin,1898,f,"Melusine, a character in Theodor Fontane's novel ""The Stechlin,"" can be described in different aspects including physical, mental, behavioral, social, and others. Here is a description of Melusine based on the available information:

Physical Description:
No specific physical details are provided in the available information regarding Melusine's appearance. However, she is described as charming, attractive, and captivating to men.

Mental Attributes:
Melusine is depicted as a witty and lighthearted individual with a playful and flirtatious nature. She possesses a certain degree of self-awareness and uses her charm and intelligence to engage in banter and teasing.

Behavioral Traits:
Melusine is known for her ability to captivate and fascinate others, particularly men. She is aware of her effect on people and enjoys flirting and playful interactions. She is somewhat vain and takes pride in her charm and attractiveness. However, she also displays a self-ironic side and is capable of self-reflection.

Social Interactions:
Melusine comes from a noble family, being the daughter of Count Barby and the sister of Armgard. She was married to an Italian Count Ghiberti, but their marriage was short-lived and ended in divorce. Due to her reluctance to carry her ex-husband's name, she is referred to by her first name. She is well-liked and admired by many, especially men who are drawn to her charisma and allure. Her social interactions are marked by her wit, charm, and a certain level of coquettishness.

Key Actions:

Melusine takes on the responsibility of raising and educating her younger sister, Armgard, after the early death of their mother. She takes pride in her sister's upbringing and the results she has achieved.
She engages in playful banter and teasing with Woldemar, causing him to feel both captivated and flustered by her attentions.
Melusine expresses her concern for Armgard's well-being in her marriage to Woldemar, seeking reassurance from Pastor Lorenzen that he will continue to support and guide Woldemar as he did in the past.
Melusine participates in discussions with Lorenzen regarding societal change, the role of Christianity, and the question of embracing the new while appreciating the old.
She demonstrates her wit and light-heartedness through her interactions with various characters, engaging them in conversations that reveal her intelligence and playfulness.
Melusine's short-lived marriage to Count Ghiberti in Florence is mentioned, but details are scarce. It is implied that the marriage quickly became unbearable for her and ended in divorce.
Melusine expresses her superstitious nature and fear of the supernatural, preferring to avoid situations that involve meddling with elemental forces or potentially encountering ghosts.
Overall, Melusine is portrayed as an enchanting and flirtatious character who possesses wit, charm, and a certain level of vanity. Her playful and self-ironic nature adds depth to her character, and she is well-regarded and admired by those around her. She engages in thought-provoking conversations and displays a certain level of introspection, particularly regarding societal changes and the role of faith.",melusine character theodor fontanes novel the stechlin described different aspect including physical mental behavioral social others description melusine based available information physical description specific physical detail provided available information regarding melusines appearance however described charming attractive captivating men mental attribute melusine depicted witty lighthearted individual playful flirtatious nature posse certain degree selfawareness us charm intelligence engage banter teasing behavioral trait melusine known ability captivate fascinate others particularly men aware effect people enjoys flirting playful interaction somewhat vain take pride charm attractiveness however also display selfironic side capable selfreflection social interaction melusine come noble family daughter count barby sister armgard married italian count ghiberti marriage shortlived ended divorce due reluctance carry exhusbands name referred first name wellliked admired many especially men drawn charisma allure social interaction marked wit charm certain level coquettishness key action melusine take responsibility raising educating younger sister armgard early death mother take pride sister upbringing result achieved engages playful banter teasing woldemar causing feel captivated flustered attention melusine express concern armgards wellbeing marriage woldemar seeking reassurance pastor lorenzen continue support guide woldemar past melusine participates discussion lorenzen regarding societal change role christianity question embracing new appreciating old demonstrates wit lightheartedness interaction various character engaging conversation reveal intelligence playfulness melusines shortlived marriage count ghiberti florence mentioned detail scarce implied marriage quickly became unbearable ended divorce melusine express superstitious nature fear supernatural preferring avoid situation involve meddling elemental force potentially encountering ghost overall melusine portrayed enchanting flirtatious character posse wit charm certain level vanity playful selfironic nature add depth character wellregarded admired around her engages thoughtprovoking conversation display certain level introspection particularly regarding societal change role faith,"[ 5.79979420e-01 -9.21186805e-01  8.67701530e-01 ... -5.39723784e-04
  8.99449646e-01 -2.40958005e-01]","[('Personality disorder', 0.43252820179792917), ('Body dysmorphic disorder', 0.4204189133105224), ('Body integrity dysphoria', 0.39859346279441865), ('Kleptomania', 0.38321888021868467), ('Gender incongruence of childhood', 0.38314893697018915)]"
Armgard,The Stechlin,1898,f,"Armgard Comtesse von Barby is the younger daughter of Count Barby and later becomes the wife of Woldemar in Theodor Fontane's novel ""The Stechlin."" Here is a description of Armgard based on the available information:

Physical Description:
Armgard's physical appearance is not extensively described. It is mentioned that she is slightly taller than her sister Melusine. On her wedding day, she is referred to as a ""pale, beautiful bride.""

Mental Attributes:
Armgard is characterized as having a serious and composed nature. She exudes a sense of strength and steadfastness, in contrast to Melusine's temperament and grace. She is not as overtly expressive as her sister, but her qualities, such as simplicity and firmness, are seen as valuable.

Behavioral Traits:
Armgard is generally more reserved and contemplative than Melusine. She is often quiet in the presence of her sister but demonstrates adeptness at directing conversations and hosting when Melusine is absent. Her piano teacher, Wrschowitz, holds her in high regard and admires her skill. Armgard does not enjoy gossip and finds ordinary life more intriguing than scandalous topics. She avoids speaking ill of others, even if she finds them unsympathetic. Unlike Melusine, Armgard is completely unassuming and occasionally reproaches her sister for her arrogance. She believes in humility and the notion that everything is granted by grace.

Social Interactions:
While there are constant comparisons between the two sisters, there is no animosity or unhealthy competition between them. They share moments of laughter and happiness, appreciating each other's beauty and qualities. Armgard is supportive and genuinely happy for Melusine during her engagement. In turn, Melusine is delighted by Armgard's contentment with Woldemar. Armgard is not as flamboyant as Melusine and has a quieter social presence. She does not engage in scandalous affairs and values the simplicity of everyday life over gossip. Armgard's humble nature and aversion to arrogance lead her to criticize Melusine at times. She is concerned with the well-being of others and expresses a desire to live for the benefit of those in need.

Key Actions:
Armgard's key actions include her marriage to Woldemar, which is initially seen as a fortuitous match due to her family's wealth and estates. However, through a letter from Armgard during their honeymoon, Melusine recognizes the depth of love between Armgard and Woldemar, despite it being uncharacteristic of Armgard's reserved nature. Armgard also expresses her preference for Woldemar to remain in the army during the wedding preparations, but after Dubslav's death, she realizes her longing for the tranquility of Stechlin and her desire for Woldemar to accompany her. This change in perspective brings happiness to Woldemar, as he feels her sentiments align with his own.

The novel concludes on the eve of Armgard's planned move to Stechlin, hinting at a contented future for her and Woldemar.",armgard comtesse von barby younger daughter count barby later becomes wife woldemar theodor fontanes novel the stechlin description armgard based available information physical description armgards physical appearance extensively described mentioned slightly taller sister melusine wedding day referred pale beautiful bride mental attribute armgard characterized serious composed nature exudes sense strength steadfastness contrast melusines temperament grace overtly expressive sister quality simplicity firmness seen valuable behavioral trait armgard generally reserved contemplative melusine often quiet presence sister demonstrates adeptness directing conversation hosting melusine absent piano teacher wrschowitz hold high regard admires skill armgard enjoy gossip find ordinary life intriguing scandalous topic avoids speaking ill others even find unsympathetic unlike melusine armgard completely unassuming occasionally reproach sister arrogance belief humility notion everything granted grace social interaction constant comparison two sister animosity unhealthy competition them share moment laughter happiness appreciating others beauty quality armgard supportive genuinely happy melusine engagement turn melusine delighted armgards contentment woldemar armgard flamboyant melusine quieter social presence engage scandalous affair value simplicity everyday life gossip armgards humble nature aversion arrogance lead criticize melusine time concerned wellbeing others express desire live benefit need key action armgards key action include marriage woldemar initially seen fortuitous match due family wealth estate however letter armgard honeymoon melusine recognizes depth love armgard woldemar despite uncharacteristic armgards reserved nature armgard also express preference woldemar remain army wedding preparation dubslavs death realizes longing tranquility stechlin desire woldemar accompany her change perspective brings happiness woldemar feel sentiment align own novel concludes eve armgards planned move stechlin hinting contented future woldemar,"[ 0.35158074 -0.00621281  0.92181528 ...  0.51531374  0.59550083
  0.20121172]","[('Separation anxiety disorder', 0.3938074334033875), ('Adjustment disorder', 0.38033494461573014), ('Prolonged grief disorder', 0.36563199644305844), ('Developmental learning disorder', 0.35792211461552087), ('Oppositional defiant disorder', 0.34538119463936245)]"
