name,novel,publishing_year,gender,description,description_words,numpy_array,similarity_scores
Yegor Ilyich Rostanev,The Village of Stepanchikovo,1859,m,"Physical Description:
Physically, Yegor Ilyich Rostanev is described as a middle-aged man with a stout figure, a round face, and small, cunning eyes. His appearance is often contrasted with his flamboyant attire, which consists of colorful, mismatched clothing and extravagant accessories. His unconventional dress sense is reflective of his unconventional personality.

Mental and Behavioral Aspects:
Yegor Ilyich Rostanev possesses a highly imaginative and eccentric mind. He is known for his daydreaming tendencies and a tendency to engage in grandiose fantasies. Rostanev often escapes reality through his vivid imagination, concocting elaborate scenarios and envisioning himself as a hero or a savior.

Social Interactions:
Rostanev's social interactions are marked by his manipulative and domineering nature. He uses his wit and charisma to assert control over others, often manipulating them to suit his whims and desires. Rostanev enjoys the attention and admiration of others, relishing his role as the center of attention in social gatherings.

Key Actions:

In the novel, Rostanev orchestrates a series of manipulations and schemes to gain control over Stepanchikovo, a country estate belonging to his relatives. He employs cunning tactics to undermine the authority of the current head of the household, his uncle, and attempts to assert his own influence over the estate and its inhabitants.

Rostanev's actions also include attempting to sway the affection of his love interest, Nastenka, by employing various strategies and playing mind games. He is determined to win her over and uses his wit and charm to try and achieve his goal.

Throughout the story, Rostanev's character is revealed through his interactions with other villagers. He displays a knack for manipulation and psychological games, often exploiting the vulnerabilities and weaknesses of others for his own benefit.

Rostanev's eccentric behavior extends to his fascination with practical jokes and humorous pranks. He finds delight in playing tricks on others, reveling in the chaos and confusion that ensues.

Overall, Yegor Ilyich Rostanev is a complex character in ""The Village of Stepanchikovo,"" characterized by his eccentricity, manipulative nature, and vivid imagination. Dostoyevsky explores themes of power, manipulation, and human behavior through Rostanev's actions and interactions with others, showcasing the intricate dynamics within a rural community.",physical description physically yegor ilyich rostanev described middleaged man stout figure round face small cunning eye appearance often contrasted flamboyant attire consists colorful mismatched clothing extravagant accessory unconventional dress sense reflective unconventional personality mental behavioral aspect yegor ilyich rostanev posse highly imaginative eccentric mind known daydreaming tendency tendency engage grandiose fantasy rostanev often escape reality vivid imagination concocting elaborate scenario envisioning hero savior social interaction rostanevs social interaction marked manipulative domineering nature us wit charisma assert control others often manipulating suit whim desire rostanev enjoys attention admiration others relishing role center attention social gathering key action novel rostanev orchestrates series manipulation scheme gain control stepanchikovo country estate belonging relative employ cunning tactic undermine authority current head household uncle attempt assert influence estate inhabitant rostanevs action also include attempting sway affection love interest nastenka employing various strategy playing mind game determined win us wit charm try achieve goal throughout story rostanevs character revealed interaction villager display knack manipulation psychological game often exploiting vulnerability weakness others benefit rostanevs eccentric behavior extends fascination practical joke humorous prank find delight playing trick others reveling chaos confusion ensues overall yegor ilyich rostanev complex character the village stepanchikovo characterized eccentricity manipulative nature vivid imagination dostoyevsky explores theme power manipulation human behavior rostanevs action interaction others showcasing intricate dynamic within rural community,"[ 0.76644081 -1.36892021  0.89342594 ... -0.35582966  0.6530149
 -0.12223418]","[('Body dysmorphic disorder', 0.5358635794435408), ('Body integrity dysphoria', 0.5265820580081514), ('Kleptomania', 0.5213591564053703), ('Personality disorder', 0.5132416897468322), ('Intermittent explosive disorder', 0.5045062876542807)]"
Nastasya Yevgrafovna / Nastenka,The Village of Stepanchikovo,1859,f,"In Fyodor Dostoevsky's novel ""The Village of Stepanchikovo,"" Nastasya Yevgrafovna, commonly referred to as Nastenka, is a central character who plays a significant role in the narrative. Here's a description of Nastenka based on different aspects:

Physical:
Nastenka is described as a young woman of striking beauty. She has delicate features, expressive eyes, and a graceful figure. Her physical appearance is often portrayed as captivating and charming.

Mental:
Nastenka is depicted as intelligent, perceptive, and emotionally sensitive. She possesses a keen understanding of human nature and is able to discern the true intentions and motives of those around her. She exhibits a capacity for empathy and depth of thought.

Behavioral:
Nastenka is characterized by her kindness, modesty, and moral integrity. She displays a sense of propriety and decorum in her actions. Nastenka is also known for her strong-willed nature and independent spirit, refusing to conform to societal expectations when they clash with her personal values.

Social:
Nastenka occupies a position of relative lower social standing in the novel. She is a governess to the children of the protagonist, Colonel Stepan Trofimovich, and is treated as part of his extended family. Despite her position, Nastenka demonstrates dignity and self-respect, and her social status does not diminish her worth or influence.

Key Actions:
1. Nastenka forms a close bond with the children under her care, demonstrating her nurturing and compassionate nature.
2. She acts as a confidante and source of emotional support for the troubled Colonel Stepan Trofimovich, offering him guidance and comfort in his moments of distress.
3. Nastenka remains steadfast in her principles when faced with attempts by various characters to manipulate or exploit her. She stands up for herself and does not compromise her values.
4. Nastenka's actions play a crucial role in the plot's development, as her presence and interactions with other characters lead to significant events and changes in their lives.

Overall, Nastenka is portrayed as a complex and admirable character, possessing both physical beauty and inner strength. Her moral compass, intelligence, and compassion make her a memorable figure in ""The Village of Stepanchikovo.""",fyodor dostoevsky novel the village stepanchikovo nastasya yevgrafovna commonly referred nastenka central character play significant role narrative here description nastenka based different aspect physical nastenka described young woman striking beauty delicate feature expressive eye graceful figure physical appearance often portrayed captivating charming mental nastenka depicted intelligent perceptive emotionally sensitive posse keen understanding human nature able discern true intention motif around her exhibit capacity empathy depth thought behavioral nastenka characterized kindness modesty moral integrity display sense propriety decorum action nastenka also known strongwilled nature independent spirit refusing conform societal expectation clash personal value social nastenka occupies position relative lower social standing novel governess child protagonist colonel stepan trofimovich treated part extended family despite position nastenka demonstrates dignity selfrespect social status diminish worth influence key action 1 nastenka form close bond child care demonstrating nurturing compassionate nature 2 act confidante source emotional support troubled colonel stepan trofimovich offering guidance comfort moment distress 3 nastenka remains steadfast principle faced attempt various character manipulate exploit her stand compromise value 4 nastenkas action play crucial role plot development presence interaction character lead significant event change life overall nastenka portrayed complex admirable character possessing physical beauty inner strength moral compass intelligence compassion make memorable figure the village stepanchikovo,"[ 0.02907299 -0.6092627  -0.11657263 ...  0.38226169  0.86244172
  0.14054452]","[('Personality disorder', 0.46374222628372513), ('Oppositional defiant disorder', 0.4245655698863436), ('Body dysmorphic disorder', 0.4243773337706437), ('Kleptomania', 0.4081404698221895), ('Hoarding disorder', 0.40631429802303665)]"
Ivan Ivanych Mizinchikov,The Village of Stepanchikovo,1859,m,"In Fyodor Dostoevsky's novel ""The Village of Stepanchikovo,"" Ivan Ivanych Mizinchikov is a prominent character who contributes to the dynamics of the story. Here's a description of Ivan Ivanych Mizinchikov based on different aspects:

Physical:
Ivan Ivanych Mizinchikov is depicted as a middle-aged man with a stout and somewhat portly physique. He is often described as having a round face, thinning hair, and a receding hairline. Dostoevsky emphasizes his physical appearance to reflect his status as a well-to-do landowner.

Mental:
Ivan Ivanych Mizinchikov is portrayed as a rather simple-minded and easily influenced individual. He lacks intellectual depth and tends to be swayed by the opinions and manipulations of others. He is prone to bouts of anxiety and is easily flustered or overwhelmed.

Behavioral:
Mizinchikov's behavior is characterized by his gullibility and naivety. He is easily manipulated by those around him, including his scheming servant, Foma, and the conniving Stepka. Mizinchikov often finds himself caught up in absurd situations and fails to assert himself or think critically.

Social:
Ivan Ivanych Mizinchikov is a member of the local gentry and occupies a position of relative privilege in society. He is the owner of the estate in Stepanchikovo and has a circle of acquaintances within the community. However, Mizinchikov's social standing does not necessarily translate into respect or admiration from others due to his easily manipulated nature.

Key Actions:
1. Mizinchikov's key action is his decision to marry Varvara Alekseyevna, a woman of questionable character. This decision sets off a chain of events that leads to conflicts and tensions within the story.
2. He allows himself to be deceived and manipulated by Foma and Stepka, who take advantage of his gullibility for their own gain.
3. Mizinchikov's inability to assert himself or make decisions leads to various misunderstandings and complications in his relationships with other characters.
4. Despite his flaws, Mizinchikov's actions highlight the theme of human weakness and vulnerability in the face of manipulation and deceit.

Overall, Ivan Ivanych Mizinchikov is portrayed as a weak-willed and easily manipulated character. His physical appearance, mental disposition, and social interactions contribute to the comedic and satirical elements of the novel.",fyodor dostoevsky novel the village stepanchikovo ivan ivanych mizinchikov prominent character contributes dynamic story here description ivan ivanych mizinchikov based different aspect physical ivan ivanych mizinchikov depicted middleaged man stout somewhat portly physique often described round face thinning hair receding hairline dostoevsky emphasizes physical appearance reflect status welltodo landowner mental ivan ivanych mizinchikov portrayed rather simpleminded easily influenced individual lack intellectual depth tends swayed opinion manipulation others prone bout anxiety easily flustered overwhelmed behavioral mizinchikovs behavior characterized gullibility naivety easily manipulated around him including scheming servant foma conniving stepka mizinchikov often find caught absurd situation fails assert think critically social ivan ivanych mizinchikov member local gentry occupies position relative privilege society owner estate stepanchikovo circle acquaintance within community however mizinchikovs social standing necessarily translate respect admiration others due easily manipulated nature key action 1 mizinchikovs key action decision marry varvara alekseyevna woman questionable character decision set chain event lead conflict tension within story 2 allows deceived manipulated foma stepka take advantage gullibility gain 3 mizinchikovs inability assert make decision lead various misunderstanding complication relationship character 4 despite flaw mizinchikovs action highlight theme human weakness vulnerability face manipulation deceit overall ivan ivanych mizinchikov portrayed weakwilled easily manipulated character physical appearance mental disposition social interaction contribute comedic satirical element novel,"[ 0.76881021 -0.69088966  1.06705499 ...  0.02348071  0.72015405
 -0.52659911]","[('Body dysmorphic disorder', 0.5433459454669585), ('Delusional disorder', 0.535149119112608), ('Intermittent explosive disorder', 0.511334297978566), ('Disinhibited social engagement disorder', 0.5019784833864702), ('Obsessive-compulsive disorder', 0.49941626282922513)]"
Pavel Semyonych Obnoskin,The Village of Stepanchikovo,1859,m,"In Fyodor Dostoevsky's novel ""The Village of Stepanchikovo,"" Pavel Semyonych Obnoskin is a prominent character who adds depth and complexity to the narrative. Here's a description of Pavel Semyonych Obnoskin based on different aspects:

Physical:
Pavel Semyonych Obnoskin is described as a tall, robust man with a commanding presence. He has a broad build and carries himself with confidence. Dostoevsky portrays him as physically imposing, emphasizing his strength and stature.

Mental:
Obnoskin is depicted as a shrewd and calculating individual. He possesses a keen intellect and is quick to grasp the motives and intentions of those around him. He demonstrates a certain level of cunning and strategic thinking.

Behavioral:
Obnoskin's behavior is marked by his assertiveness and assertive nature. He is not afraid to voice his opinions and takes an active role in social interactions. Obnoskin is known for his brash and confrontational manner, often challenging others and engaging in verbal sparring.

Social:
Pavel Semyonych Obnoskin holds a position of influence and power within the community. He is a respected landowner and is seen as an important figure among his peers. Obnoskin's social standing grants him a certain level of authority and allows him to assert his opinions with confidence.

Key Actions:
1. Obnoskin plays a crucial role in the conflicts and power struggles within the story. He is often involved in confrontations with other characters, particularly Colonel Stepan Trofimovich and Ivan Ivanych Mizinchikov.
2. He takes a particular interest in Nastasya Yevgrafovna, also known as Nastenka, and expresses his desire to marry her. This pursuit creates tension and complicates the relationships between various characters.
3. Obnoskin actively participates in the social dynamics of Stepanchikovo, engaging in debates and discussions on various topics. He often expresses his opinions forcefully and challenges others' viewpoints.
4. His actions and interactions with other characters reveal his ambition, cunning, and willingness to manipulate situations to his advantage.

Overall, Pavel Semyonych Obnoskin is depicted as a strong-willed, assertive character with a commanding presence. His physical stature, intellectual acuity, and social influence make him a formidable force within the narrative, driving conflicts and shaping the events of the story.",fyodor dostoevsky novel the village stepanchikovo pavel semyonych obnoskin prominent character add depth complexity narrative here description pavel semyonych obnoskin based different aspect physical pavel semyonych obnoskin described tall robust man commanding presence broad build carry confidence dostoevsky portrays physically imposing emphasizing strength stature mental obnoskin depicted shrewd calculating individual posse keen intellect quick grasp motif intention around him demonstrates certain level cunning strategic thinking behavioral obnoskins behavior marked assertiveness assertive nature afraid voice opinion take active role social interaction obnoskin known brash confrontational manner often challenging others engaging verbal sparring social pavel semyonych obnoskin hold position influence power within community respected landowner seen important figure among peer obnoskins social standing grant certain level authority allows assert opinion confidence key action 1 obnoskin play crucial role conflict power struggle within story often involved confrontation character particularly colonel stepan trofimovich ivan ivanych mizinchikov 2 take particular interest nastasya yevgrafovna also known nastenka express desire marry her pursuit creates tension complicates relationship various character 3 obnoskin actively participates social dynamic stepanchikovo engaging debate discussion various topic often express opinion forcefully challenge others viewpoint 4 action interaction character reveal ambition cunning willingness manipulate situation advantage overall pavel semyonych obnoskin depicted strongwilled assertive character commanding presence physical stature intellectual acuity social influence make formidable force within narrative driving conflict shaping event story,"[ 0.78133208 -0.7357378   0.89098561 ...  0.07726341  0.1439442
 -0.47053659]","[('Oppositional defiant disorder', 0.5270899578352721), ('Intermittent explosive disorder', 0.48485217137486997), ('Body dysmorphic disorder', 0.4749983134228407), ('Adjustment disorder', 0.45283108090816626), ('Schizotypal disorder', 0.44840824455150774)]"
Ivan Petrovich,Humiliated and Insulted,1861,m,"In Fyodor Dostoevsky's novel ""Humiliated and Insulted,"" Ivan Petrovich is a central character. Here is a description of his different aspects:

Physical: Ivan Petrovich is described as a tall and imposing man. He possesses a strong physical presence that commands attention and respect from others.

Mental: Ivan Petrovich is depicted as an intelligent and thoughtful individual. He displays a keen understanding of human nature and often reflects on philosophical and moral questions. He is introspective and contemplative, with a tendency to analyze situations deeply.

Behavioral: Ivan Petrovich exhibits a stoic and reserved demeanor. He tends to be composed and controlled in his actions, seldom displaying outward emotions. He is known for his strong sense of justice and fairness, which guides his behavior and interactions with others.

Social: Ivan Petrovich is well-regarded in social circles and has a respectable reputation. He is seen as a man of integrity and moral character. Despite his reserved nature, he maintains close friendships and is respected by those who know him.

Other Aspects: Ivan Petrovich is driven by a strong sense of duty and responsibility. He often prioritizes the needs and well-being of others over his own. He is characterized by his loyalty and willingness to sacrifice for the sake of those he cares about.

Key Actions: Ivan Petrovich's key actions include supporting and advocating for the protagonist, Natasha, in her time of need. He provides emotional support and practical assistance, acting as a reliable and trustworthy friend. He also serves as a moral compass, offering guidance and wise counsel to those around him.

Overall, Ivan Petrovich is a complex character in ""Humiliated and Insulted"" who embodies strength, intelligence, and moral integrity. His reserved demeanor and strong sense of justice make him a respected figure among his peers. Through his actions, he demonstrates loyalty, compassion, and a commitment to doing what is right, even in the face of adversity.",fyodor dostoevsky novel humiliated insulted ivan petrovich central character description different aspect physical ivan petrovich described tall imposing man posse strong physical presence command attention respect others mental ivan petrovich depicted intelligent thoughtful individual display keen understanding human nature often reflects philosophical moral question introspective contemplative tendency analyze situation deeply behavioral ivan petrovich exhibit stoic reserved demeanor tends composed controlled action seldom displaying outward emotion known strong sense justice fairness guide behavior interaction others social ivan petrovich wellregarded social circle respectable reputation seen man integrity moral character despite reserved nature maintains close friendship respected know him aspect ivan petrovich driven strong sense duty responsibility often prioritizes need wellbeing others own characterized loyalty willingness sacrifice sake care about key action ivan petrovichs key action include supporting advocating protagonist natasha time need provides emotional support practical assistance acting reliable trustworthy friend also serf moral compass offering guidance wise counsel around him overall ivan petrovich complex character humiliated insulted embodies strength intelligence moral integrity reserved demeanor strong sense justice make respected figure among peer action demonstrates loyalty compassion commitment right even face adversity,"[ 0.95289493 -0.46014306  1.0495466  ...  0.08623583  0.52033377
 -0.2233869 ]","[('Oppositional defiant disorder', 0.5276504478359908), ('Personality disorder', 0.49364065739067353), ('Obsessive-compulsive disorder', 0.4933179288063022), ('Intermittent explosive disorder', 0.4654389903594295), ('Adjustment disorder', 0.4501446030464741)]"
