name,novel,publishing_year,gender,description,description_words,numpy_array,similarity_scores
Varvara Dobroselova,Poor Folk,1846,f,"Physical Description:
Varvara Alexievna is described as a young woman in her twenties. She is portrayed as attractive, with delicate features and a graceful presence. Her appearance is often emphasized, with references to her beauty, bright eyes, and captivating smile.

Mental and Emotional Traits:
Varvara Alexievna is depicted as intelligent and well-educated. She possesses a keen intellect and a love for literature and the arts. Her mental faculties are highlighted through her eloquence in letter writing, as the novel is presented as a series of correspondences between the characters. She exhibits empathy and sensitivity towards others, particularly towards the protagonist, Makar Devushkin.

Behavioral Characteristics:
Varvara Alexievna is known for her kindness and compassion. She displays a caring nature and shows genuine concern for the well-being of others. Her behavior is marked by a sense of selflessness, as she often puts the needs and happiness of others above her own. Varvara Alexievna's actions are driven by a desire to alleviate the suffering of those around her.

Social Standing:
Varvara Alexievna comes from a higher social class compared to Makar Devushkin, the novel's impoverished protagonist. She belongs to a more privileged background and enjoys a comfortable lifestyle. This social disparity between Varvara and Makar adds to the complexity and tension in their relationship.

Key Actions:

Correspondence with Makar: Varvara Alexievna engages in a frequent and intimate exchange of letters with Makar Devushkin, a poor civil servant who is infatuated with her. These letters serve as a medium for their emotional connection and reveal the depth of their relationship.

Financial Assistance: Varvara Alexievna demonstrates her generosity by offering financial support to Makar Devushkin and other impoverished individuals in her social circle. She provides monetary assistance to help alleviate their financial hardships and improve their living conditions.

Emotional Support: Varvara Alexievna offers emotional solace to Makar, providing a compassionate ear and understanding presence. She acts as a confidante and friend, offering comfort and reassurance during his moments of despair.

Sacrifices for Others: Varvara Alexievna exhibits a willingness to sacrifice her own happiness for the sake of others. She suppresses her own feelings and desires, placing the well-being of Makar and others before her own personal needs.

Overall, Varvara Alexievna is depicted as a compassionate, empathetic, and selfless character in ""Poor Folk."" Her actions and interactions with Makar Devushkin highlight her caring nature and her ability to bring solace to those in need, despite the social barriers that separate them.",physical description varvara alexievna described young woman twenty portrayed attractive delicate feature graceful presence appearance often emphasized reference beauty bright eye captivating smile mental emotional trait varvara alexievna depicted intelligent welleducated posse keen intellect love literature art mental faculty highlighted eloquence letter writing novel presented series correspondence character exhibit empathy sensitivity towards others particularly towards protagonist makar devushkin behavioral characteristic varvara alexievna known kindness compassion display caring nature show genuine concern wellbeing others behavior marked sense selflessness often put need happiness others own varvara alexievnas action driven desire alleviate suffering around her social standing varvara alexievna come higher social class compared makar devushkin novel impoverished protagonist belongs privileged background enjoys comfortable lifestyle social disparity varvara makar add complexity tension relationship key action correspondence makar varvara alexievna engages frequent intimate exchange letter makar devushkin poor civil servant infatuated her letter serve medium emotional connection reveal depth relationship financial assistance varvara alexievna demonstrates generosity offering financial support makar devushkin impoverished individual social circle provides monetary assistance help alleviate financial hardship improve living condition emotional support varvara alexievna offer emotional solace makar providing compassionate ear understanding presence act confidante friend offering comfort reassurance moment despair sacrifice others varvara alexievna exhibit willingness sacrifice happiness sake others suppresses feeling desire placing wellbeing makar others personal need overall varvara alexievna depicted compassionate empathetic selfless character poor folk action interaction makar devushkin highlight caring nature ability bring solace need despite social barrier separate them,"[ 0.06432909 -0.6956917  -0.20141788 ...  0.01465081  1.10797954
 -0.24023935]","[('Personality disorder', 0.4802189137037553), ('Oppositional defiant disorder', 0.4350817498071859), ('Hoarding disorder', 0.4018376227123267), ('Adjustment disorder', 0.3940566663725337), ('Body integrity dysphoria', 0.3689428466516492)]"
Makar Devushkin,Poor Folk,1846,m,"Physical:
Physically, Makar is described as a small, frail, and unattractive man. He is often portrayed as hunchbacked, with unkempt hair, and a generally disheveled appearance. Dostoyevsky emphasizes his physical fragility to highlight the hardships and poverty that Makar endures.

Mental:
Makar possesses a kind and gentle nature. He is characterized by his sensitivity, emotional vulnerability, and profound empathy for others. He is introspective and introspective, often spending his time reflecting on his life and circumstances. Makar has a vivid and imaginative inner world, finding solace in his rich imagination and the act of writing letters to a female friend, Varvara Dobroselova.

Behavioral:
Makar is a humble and self-effacing individual. He is known for his extreme selflessness, often sacrificing his own needs and desires for the well-being of others. He is hardworking and diligent in his job, despite being poorly paid. Makar is also deeply religious, finding solace and guidance in his faith.

Social:
Makar is socially isolated due to his poverty and low social status. He lives in a small, cramped apartment in a run-down building, surrounded by similarly impoverished individuals. His only significant social interaction is through his correspondence with Varvara, whom he considers his only friend. Makar is keenly aware of his social standing and is often filled with shame and humiliation due to his circumstances.

Key Actions:
One of Makar's key actions is his correspondence with Varvara. He pours his heart and soul into his letters, expressing his love, devotion, and struggles. These letters serve as a window into his inner world and reveal his capacity for deep emotion and introspection.

Makar also experiences unrequited love for his coworker, Barbara Alexievna. He harbors strong feelings for her but is unable to express them due to his own insecurities and fear of rejection. This unrequited love becomes a source of anguish and longing for him.

Additionally, Makar's ultimate act of self-sacrifice is seen towards the end of the novel when he anonymously gives away his meager savings to help a destitute stranger, even though it leaves him in an even more dire situation.

In summary, Makar Devushkin is a physically unremarkable and mentally sensitive character in ""Poor Folk."" He demonstrates selflessness, humility, and a deep capacity for love and empathy. Despite his poverty and social isolation, Makar's actions and inner world reveal his strength of character and resilience in the face of adversity.",physical physically makar described small frail unattractive man often portrayed hunchbacked unkempt hair generally disheveled appearance dostoyevsky emphasizes physical fragility highlight hardship poverty makar endures mental makar posse kind gentle nature characterized sensitivity emotional vulnerability profound empathy others introspective introspective often spending time reflecting life circumstance makar vivid imaginative inner world finding solace rich imagination act writing letter female friend varvara dobroselova behavioral makar humble selfeffacing individual known extreme selflessness often sacrificing need desire wellbeing others hardworking diligent job despite poorly paid makar also deeply religious finding solace guidance faith social makar socially isolated due poverty low social status life small cramped apartment rundown building surrounded similarly impoverished individual significant social interaction correspondence varvara considers friend makar keenly aware social standing often filled shame humiliation due circumstance key action one makars key action correspondence varvara pours heart soul letter expressing love devotion struggle letter serve window inner world reveal capacity deep emotion introspection makar also experience unrequited love coworker barbara alexievna harbor strong feeling unable express due insecurity fear rejection unrequited love becomes source anguish longing him additionally makars ultimate act selfsacrifice seen towards end novel anonymously give away meager saving help destitute stranger even though leaf even dire situation summary makar devushkin physically unremarkable mentally sensitive character poor folk demonstrates selflessness humility deep capacity love empathy despite poverty social isolation makars action inner world reveal strength character resilience face adversity,"[ 0.48486173 -0.80662924  0.46571565 ... -0.54627329  0.87690848
 -0.27184904]","[('Selective mutism', 0.5353651815601776), ('Body integrity dysphoria', 0.5174564622594813), ('Adjustment disorder', 0.5171397400296169), ('Disinhibited social engagement disorder', 0.5053424197292284), ('Compulsive sexual behaviour disorder', 0.5017650294593188)]"
Mr. Bykov,Poor Folk,1846,m,"Physical Description:
Mr. Bykov is depicted as a middle-aged man with a slightly stooped posture and a thin, gaunt appearance. Dostoyevsky describes him as having a pale face, sunken cheeks, and hollow eyes. His physical appearance reflects the hardships and struggles he has endured in life.

Mental and Emotional Characteristics:
Mr. Bykov is portrayed as an intelligent and well-read individual. He is a clerk by profession and possesses a sharp intellect. He is known for his literary knowledge and enjoys engaging in intellectual discussions. However, Mr. Bykov also exhibits a certain degree of bitterness and disillusionment, which is a consequence of his impoverished and difficult circumstances.

Behavioral Traits:
Mr. Bykov is introverted and reserved, often lost in his own thoughts. He tends to be cautious and meticulous in his actions, as he is acutely aware of his financial limitations. He is a man of routine and often spends his evenings writing letters to his beloved, Varvara Dobroselova, expressing his innermost thoughts and emotions.

Social Standing:
Mr. Bykov belongs to the lower strata of society, representing the impoverished and struggling class. He lives in a modest room and endures constant financial hardship. Despite his social status, he maintains his dignity and remains committed to his principles.

Key Actions:

Letter Writing: Mr. Bykov's most significant action in the novel is his extensive letter-writing correspondence with Varvara Dobroselova, a young woman of higher social standing. Through these letters, he expresses his love, devotion, and inner turmoil, revealing his depth of emotion and desire for a better life.
Friendship with Makar Devushkin: Mr. Bykov develops a close friendship with Makar Devushkin, another impoverished character in the novel. They share their struggles, hopes, and dreams, offering each other support and solace in their challenging circumstances.
Self-Sacrifice: Mr. Bykov demonstrates self-sacrifice by encouraging Varvara to pursue a more prosperous life with a wealthier suitor, despite his own affection for her. He prioritizes her happiness over his own desires, illustrating his nobility of character.
Overall, Mr. Bykov embodies the plight of the impoverished class in ""Poor Folk."" Through his introspection, intellectualism, and selflessness, he serves as a representative of the human spirit and the endurance of the human soul amidst adversity.",physical description mr bykov depicted middleaged man slightly stooped posture thin gaunt appearance dostoyevsky describes pale face sunken cheek hollow eye physical appearance reflects hardship struggle endured life mental emotional characteristic mr bykov portrayed intelligent wellread individual clerk profession posse sharp intellect known literary knowledge enjoys engaging intellectual discussion however mr bykov also exhibit certain degree bitterness disillusionment consequence impoverished difficult circumstance behavioral trait mr bykov introverted reserved often lost thought tends cautious meticulous action acutely aware financial limitation man routine often spends evening writing letter beloved varvara dobroselova expressing innermost thought emotion social standing mr bykov belongs lower stratum society representing impoverished struggling class life modest room endures constant financial hardship despite social status maintains dignity remains committed principle key action letter writing mr bykovs significant action novel extensive letterwriting correspondence varvara dobroselova young woman higher social standing letter express love devotion inner turmoil revealing depth emotion desire better life friendship makar devushkin mr bykov develops close friendship makar devushkin another impoverished character novel share struggle hope dream offering support solace challenging circumstance selfsacrifice mr bykov demonstrates selfsacrifice encouraging varvara pursue prosperous life wealthier suitor despite affection her prioritizes happiness desire illustrating nobility character overall mr bykov embodies plight impoverished class poor folk introspection intellectualism selflessness serf representative human spirit endurance human soul amidst adversity,"[ 0.7408855  -0.43207628  1.01411641 ...  0.13313475  0.68419302
 -0.36212575]","[('Developmental learning disorder', 0.5437416107247985), ('Adjustment disorder', 0.5298937984280341), ('Prolonged grief disorder', 0.48974061654403506), ('Oppositional defiant disorder', 0.4895059264583407), ('Selective mutism', 0.4807171430522048)]"
Anna Fyodorovna,Poor Folk,1846,f,"Physical Description:
Anna Fedorovna is described as a middle-aged woman with a pale complexion. She is portrayed as thin and frail, with features that reflect her impoverished circumstances. Dostoyevsky often emphasizes her worn appearance, suggesting the hardships she has endured.

Mental and Emotional Aspects:
Anna Fedorovna is depicted as a sensitive and compassionate woman. She possesses a kind and sympathetic nature, showing genuine concern for those around her. Despite her own struggles, she maintains a resilient spirit and displays empathy towards others. Her mental state is characterized by resilience and a deep capacity for emotional understanding.

Behavioral Traits:
Anna Fedorovna is shown as a selfless and caring individual. She acts as a caregiver to Makar Devushkin, the protagonist of the novel, and provides emotional support to him despite her own difficulties. Her actions consistently reflect her nurturing and protective nature, as she goes above and beyond to assist those in need.

Social Position:
Anna Fedorovna belongs to the lower class, struggling with poverty and challenging living conditions. Her social status is a key aspect of her character, influencing her interactions with others and shaping her worldview. Her experiences as a poor woman offer insights into the plight of the working class and highlight the societal inequalities of the time.

Key Actions:

Support for Makar Devushkin: Anna Fedorovna plays a crucial role in Makar Devushkin's life, offering him emotional support and companionship. She assists him with his correspondence, helping him navigate his complex relationships.

Letters to Barbara Dobroselova: Anna Fedorovna writes letters to Barbara, expressing her concern for Makar's well-being and attempting to bridge the gap between them. These letters reveal her love and dedication towards Makar, even in the face of rejection.

Sacrifices for Makar: Anna Fedorovna makes numerous sacrifices for Makar, including selling her possessions to provide financial assistance. Her selflessness is evident in her actions as she prioritizes Makar's needs above her own.

Death: Towards the end of the novel, Anna Fedorovna's health deteriorates, and she tragically passes away. Her death serves as a poignant moment, highlighting the hardships faced by those in poverty and emphasizing the emotional toll of their circumstances.

Overall, Anna Fedorovna's character in ""Poor Folk"" embodies compassion, resilience, and selflessness. Her actions and interactions contribute to the novel's exploration of social inequality, love, and the human capacity for empathy in the face of adversity.",physical description anna fedorovna described middleaged woman pale complexion portrayed thin frail feature reflect impoverished circumstance dostoyevsky often emphasizes worn appearance suggesting hardship endured mental emotional aspect anna fedorovna depicted sensitive compassionate woman posse kind sympathetic nature showing genuine concern around her despite struggle maintains resilient spirit display empathy towards others mental state characterized resilience deep capacity emotional understanding behavioral trait anna fedorovna shown selfless caring individual act caregiver makar devushkin protagonist novel provides emotional support despite difficulty action consistently reflect nurturing protective nature go beyond assist need social position anna fedorovna belongs lower class struggling poverty challenging living condition social status key aspect character influencing interaction others shaping worldview experience poor woman offer insight plight working class highlight societal inequality time key action support makar devushkin anna fedorovna play crucial role makar devushkins life offering emotional support companionship assist correspondence helping navigate complex relationship letter barbara dobroselova anna fedorovna writes letter barbara expressing concern makars wellbeing attempting bridge gap them letter reveal love dedication towards makar even face rejection sacrifice makar anna fedorovna make numerous sacrifice makar including selling possession provide financial assistance selflessness evident action prioritizes makars need own death towards end novel anna fedorovnas health deteriorates tragically pass away death serf poignant moment highlighting hardship faced poverty emphasizing emotional toll circumstance overall anna fedorovnas character poor folk embodies compassion resilience selflessness action interaction contribute novel exploration social inequality love human capacity empathy face adversity,"[ 0.14862359 -0.63254088  0.03358049 ... -0.97597051  0.60633945
 -0.57199442]","[('Prolonged grief disorder', 0.49986565997715215), ('Adjustment disorder', 0.49487964039705495), ('Binge eating disorder', 0.4649121147075177), ('Separation anxiety disorder', 0.45840029171775604), ('Selective mutism', 0.45755415554335194)]"
Pokrovsky,Poor Folk,1846,m,"Physical Description:
Pokrovsky is described as a thin, pale, and sickly-looking man. He is often seen wearing shabby clothes, emphasizing his poverty and downtrodden appearance.

Mental State:
Pokrovsky is depicted as an intelligent and sensitive individual. He possesses a sharp intellect and a keen awareness of the social and economic disparities around him. He is deeply introspective and prone to melancholy, reflecting on his own impoverished state and the challenges he faces in society.

Behavioral Traits:
Pokrovsky exhibits introverted and contemplative behavior. He is often withdrawn, spending much of his time in solitude, reflecting on his circumstances and writing letters. He possesses a kind and compassionate nature, showing empathy towards others, particularly his friend Makar Devushkin.

Social Standing:
Pokrovsky belongs to the lower strata of society and is one of the ""poor folk"" referenced in the novel's title. He lives in a cramped and dilapidated apartment, struggling to make ends meet. His financial situation places him at a disadvantage in a society that values wealth and social status.

Key Actions:

Letter Writing: Pokrovsky frequently writes letters, particularly to his wealthy friend Varvara Dobroselova. These letters serve as a means of expression and communication, allowing Pokrovsky to share his thoughts, feelings, and hopes.

Relationship with Makar Devushkin: Pokrovsky forms a close friendship with Makar, another impoverished character in the novel. They share their hardships and support each other emotionally.

Unrequited Love: Pokrovsky develops romantic feelings for Varvara Dobroselova, but his love remains unrequited. He pours out his emotions and desires through his letters to her.

Dignity in Poverty: Despite his impoverished circumstances, Pokrovsky maintains a sense of dignity. He refuses to compromise his principles or engage in dishonest means to improve his situation, even when opportunities arise.

Pokrovsky's character in ""Poor Folk"" embodies the struggles, resilience, and moral integrity of those living in poverty. Dostoyevsky explores the themes of social inequality, human connection, and the human spirit's ability to find solace and meaning amidst adversity through Pokrovsky's experiences and actions.",physical description pokrovsky described thin pale sicklylooking man often seen wearing shabby clothes emphasizing poverty downtrodden appearance mental state pokrovsky depicted intelligent sensitive individual posse sharp intellect keen awareness social economic disparity around him deeply introspective prone melancholy reflecting impoverished state challenge face society behavioral trait pokrovsky exhibit introverted contemplative behavior often withdrawn spending much time solitude reflecting circumstance writing letter posse kind compassionate nature showing empathy towards others particularly friend makar devushkin social standing pokrovsky belongs lower stratum society one poor folk referenced novel title life cramped dilapidated apartment struggling make end meet financial situation place disadvantage society value wealth social status key action letter writing pokrovsky frequently writes letter particularly wealthy friend varvara dobroselova letter serve mean expression communication allowing pokrovsky share thought feeling hope relationship makar devushkin pokrovsky form close friendship makar another impoverished character novel share hardship support emotionally unrequited love pokrovsky develops romantic feeling varvara dobroselova love remains unrequited pours emotion desire letter her dignity poverty despite impoverished circumstance pokrovsky maintains sense dignity refuse compromise principle engage dishonest mean improve situation even opportunity arise pokrovskys character poor folk embodies struggle resilience moral integrity living poverty dostoyevsky explores theme social inequality human connection human spirit ability find solace meaning amidst adversity pokrovskys experience action,"[ 0.77372599 -0.34689263  0.64786601 ... -0.66985989  0.73853493
 -0.28056753]","[('Selective mutism', 0.5383142810512912), ('Developmental learning disorder', 0.49616329260041164), ('Prolonged grief disorder', 0.4533841031511976), ('Adjustment disorder', 0.437491553554758), ('Mild neurocognitive disorder', 0.43521415228280214)]"
